14/07/2015 11:37:50 AM,11,,,,,,,,,,,,,,,,,,
P,20150714,120883432,9,5859675,,,,,,,,,,,,,,,
165576622,PT GRIYA MIESEJATI,177585,46675 DS_14072015,,,,,,,,,,,,,N,,,N
154220453,PT. Lestari Mitra Sembada,1692900,46667 DS_14072015,,,,,,,,,,,,,N,,,N
154220453,PT. Lestari Mitra Sembada,1202850,46666 DS_14072015,,,,,,,,,,,,,N,,,N
0024460132,PT. Kharisma Maju Abadi,499950,46644 DS_14072015,,,,,,,,,,,,,N,,,N
0165696611,PT GRIYA MIESEJATI,88490,46600 DS_14072015,,,,,,,,,,,,,N,,,N
154220453,PT. Lestari Mitra Sembada,1113750,46628 DS_14072015,,,,,,,,,,,,,N,,,N
0110247217,PT. Nusantara Sejahtera Raya,579150,46639 DS_14072015,,,,,,,,,,,,,N,,,N
0014477829,Reg Jabotabek   graPARI  Jakarta Selatan,5000,46580 GraPARI Wisma Mulia,,,,,,,,,,,,,N,,,N
0080346669,Reg Sulmalirja graPARI Kendari,500000,46578 GraPARI Kendari,,,,,,,,,,,,,N,,,N
