06/10/2014 11:30:11 AM,10,,,,,,,,,,,,,,,,,,
P,20141006,120883432,8,14111264,,,,,,,,,,,,,,,
0185934904,PT Media Indonusa ,5165749,37931 TCash Periode 24 September-1 Oktober 2014,,,,,,,,,,,,,N,,,N
51194552,Reg Sumbagteng  graPARI Padang,2540000,37922 GraPARI Padang,,,,,,,,,,,,,N,,,N
69883032,Reg Sumbagsel  graPARI Jambi,1070000,37921 GraPARI Jambi,,,,,,,,,,,,,N,,,N
8118128136,Reg Sumbagsel  graPARI Lampung,320000,37920 GraPARI Lampung,,,,,,,,,,,,,N,,,N
0077980171,Reg Sumbagteng  graPARI Pekanbaru,1337000,37919 GraPARI Pekanbaru,,,,,,,,,,,,,N,,,N
0088976660,Reg Sulmalirja graPARI Sorong,2058515,37918 GraPARI Sorong,,,,,,,,,,,,,N,,,N
69883032,Reg Sumbagsel  graPARI Jambi,1120000,37915 GraPARI Jambi,,,,,,,,,,,,,N,,,N
0057862208,Reg Sumbagut  graPARI Medan,500000,37909 GraPARI Medan Selecta,,,,,,,,,,,,,N,,,N
