17/11/2014 10:53:57 AM,9,,,,,,,,,,,,,,,,,,
P,20141117,120883432,7,1655480,,,,,,,,,,,,,,,
0065667219,Reg Sulmalirja graPARI Makassar,150000,38229 GraPARI Makassar,,,,,,,,,,,,,N,,,N
69883032,Reg Sumbagsel  graPARI Jambi,120000,38227 GraPARI Jambi,,,,,,,,,,,,,N,,,N
8118128136,Reg Sumbagsel  graPARI Lampung,15000,38226 GraPARI Lampung,,,,,,,,,,,,,N,,,N
8118128136,Reg Sumbagsel  graPARI Lampung,40000,38224 GraPARI Lampung,,,,,,,,,,,,,N,,,N
51447641,Reg Sumbagsel  graPARI Palembang,485000,38223 GraPARI Palembang,,,,,,,,,,,,,N,,,N
0123786673,Reg Sulmalirja graPARI Ambon,50240,38222 GraPARI Ambon,,,,,,,,,,,,,N,,,N
0123786673,Reg Sulmalirja graPARI Ambon,795240,38220 GraPARI Ambon,,,,,,,,,,,,,N,,,N
